<?xml version="1.0" encoding="UTF-8"?>
<DanhSachSach xmlns:xsi="http://www.w3.org/2001/XMLSchema-instance"
                 xsi:noNamespaceSchemaLocation="sach.xsd">


    <Sach ISBN="9781234567890">
        <TieuDe>Lap Trinh Python</TieuDe>
        <TacGia>Nguyen Van A</TacGia>
        <NamXuatBan>2020</NamXuatBan>
    </Sach>
    <Sach ISBN="9780987654321">
        <TieuDe>Toan Cao Cap</TieuDe>
        <TacGia>Tran Thi B</TacGia>
        <NamXuatBan>2018</NamXuatBan>
    </Sach>

</DanhSachSach>